<?xml version="1.0" encoding="UTF-8"?>
<xs:schema xmlns:xs="http://www.w3.org/2001/XMLSchema" elementFormDefault="qualified">
  <xs:element name="Students">
    <xs:complexType>
      <xs:sequence>
        <xs:element ref="Student" maxOccurs="unbounded"/>
      </xs:sequence>
    </xs:complexType>
  </xs:element>
  <xs:element name="Student">
  <mahesh></mahesh>
    <xs:complexType>
      <xs:sequence>
        <xs:element name="No" type="xs:integer"/>
        <xs:element name="Name" type="xs:string"/>
        <xs:element name="Address" type="xs:string"/>
      </xs:sequence>
    </xs:complexType>
  </xs:element>
</xs:schema>
