<?xml version="1.0" encoding="UTF-8"?>
<Students xmlns:xsi="http://www.w3.org/2001/XMLSchema-instance" 
                     xsi:noNamespaceSchemaLocation="/home/osboxes/Desktop/DAC/Students.xsd">
  <Student>
   <No>1</No>  
   <Name>Lalit</Name>
   <Address>Pune</Address>
  </Student>
  <Student>
   <No>2</No>  
   <Name>Jatin</Name>
  <Address>Chennai</Address>
  
  </Student>
</Students>